{
  "evidence_id": "E-ZPZ-125-001",
  "rule_refs": [
    "ZPZ-125"
  ],
  "citation": {
    "original_text": "八字用神,专求月令,以日干配月令地支,而生克不同,格局分焉。",
    "language": "classical_chinese"
  },
  "modern_paraphrase": "取格以月令提纲为纲(同 E-ZPZ-101 锚定的《论用神》句)。本条 ZPZ-125 编码梯二「非当令食神透干 → OUTPUT(透则显)」。status=draft(UR-012):暂不接入实时信号层。食神→OUTPUT 的 USO 映射为 v1 工程基线(依 §5.1 十神→USO),非原文直引,待校准。",
  "source_locator": {
    "work": "子平真诠",
    "edition": "通行本",
    "chapter": "论用神"
  },
  "evidence_strength": "secondary",
  "version": "1.0.0",
  "created_at": "2026-08-17T00:00:00Z",
  "source_layer": "classical_original",
  "edition_id": "EDITION-ZIPING-ZHENQUAN-XULEWU"
}
