{
  "evidence_id": "E-SMTH-104-001",
  "rule_refs": [
    "SMTH-104"
  ],
  "citation": {
    "original_text": "(待校,paraphrase)天乙贵人:以日干查命局地支(甲戊庚牛羊,乙己鼠猴乡,丙丁猪鸡位,壬癸兔蛇藏,六辛逢马虎),见者为吉,主贵人扶助、逢凶化吉。三命通会·论天乙贵人,原文逐字未核验,不引文。",
    "language": "vernacular_chinese",
    "verification_status": "pending_verification"
  },
  "modern_paraphrase": "《三命通会·卷二·论天乙贵人》通行口诀「甲戊庚牛羊…」:日干查命局地支。SMTH-104(天乙贵人→SUPPORT)以此为准(待校 paraphrase)。口诀表为通行定式(bazi_fixed_tables.TIANYI_GUIREN),非虚构原文;阴贵/阳贵细分不在本轮。",
  "source_locator": {
    "work": "三命通会",
    "edition": "通行本(十二卷)",
    "chapter": "卷二·论天乙贵人"
  },
  "evidence_strength": "tertiary",
  "version": "1.0.0",
  "created_at": "2026-08-19T00:00:00Z",
  "source_layer": "paraphrase",
  "edition_id": "EDITION-SANMING-TONGHUI-SHIERJUAN"
}
